{
  "schemaVersion": 1,
  "assetId": "ast_019c1a23-4570-7abc-8def-0123456789ab",
  "type": "interior",
  "lifecycle": {
    "status": "draft"
  },
  "classification": {
    "tags": ["humble"]
  },
  "details": {
    "interiorFunctionId": "tavern"
  },
  "visual": {
    "visualProfileId": "nimroel-interior-generic",
    "visualProfileVersion": "0.1",
    "lightingId": "warm"
  },
  "content": {
    "mimeType": "image/webp",
    "widthPx": 2048,
    "heightPx": 1152,
    "sha256": "4444444444444444444444444444444444444444444444444444444444444444"
  },
  "provenance": {
    "originKind": "generated",
    "generator": {
      "provider": "chatgpt",
      "generatedAt": "2026-09-12T10:15:00Z"
    },
    "promptTemplateId": "interior",
    "promptTemplateVersion": "0.1"
  },
  "extensions": {
    "dev.nimroel.production": {
      "reviewNote": "Fixture illustrating a namespaced experimental extension."
    }
  }
}
